{
  "schema_version": "2.2.0",
  "run_id": "0bc666d1-92a3-4fa5-9c44-0ef402cc65c6",
  "factory_version": "foundry",
  "run_mode": "implementation",
  "ticket_source": "jira",
  "current_step": "deliver.gate",
  "issue_key": "TICKET-2327",
  "app_folder": "Example.Api",
  "factory_root": "C:/repos/ORG/factory",
  "resolved_profile_hash": "92b7f02e46b6afaaed6e944a22fe150957008e9befa3d78c736c744188c33ad1",
  "app_manifest_id": "kt-shared-emailprocessor-iris",
  "app_manifest_hash": "3ba7de3e98611e959e0b5fae319b9c18cb737dd2b0a0203a04fdb6bb4b3de58a",
  "app_manifest_platform": "windows",
  "developer_first_name": "lynn",
  "atlassian_source": "plugin",
  "default_branch": "main",
  "feature_branch": "lynn/TICKET-2327",
  "resolved_pr_title": "TICKET-2327 - Iris email attachment support",
  "risk_tier": "high",
  "risk_tier_source": "auto",
  "interaction_mode": "drive_to_pr",
  "approved_ac_version": 2,
  "approved_ac": [
    { "id": "ac-1", "text": "Given a valid attachment URL, when processed, then blob is fetched and attached.", "source": "grilling" },
    { "id": "ac-2", "text": "Given SMTP failure after send, when retried, then idempotency prevents duplicate delivery.", "source": "proposed" }
  ],
  "assumptions": ["35 MB cap is per attachment, not combined"],
  "execution_graph_id": "a1b2c3d4-e5f6-7890-abcd-ef1234567890",
  "steps": {
    "intake.refine": { "status": "completed", "receipt_id": "ae57a681-0000-4000-8000-000000000001" },
    "intake.grill": { "status": "skipped" },
    "intake.present_ac": { "status": "completed", "human_approved": true },
    "intake.approve_ac": { "status": "completed", "approved": true },
    "plan.research": { "status": "completed", "report": "received", "receipt_id": "c3cb3c07-0000-4000-8000-000000000002" },
    "plan.graph": { "status": "completed", "approved": true, "human_approved": true },
    "implement.build": { "status": "completed", "report": "received" },
    "implement.validate": { "status": "completed", "report": "received" },
    "implement.code_review": { "status": "completed", "approved": true, "human_approved": true },
    "implement.pre_pr_review": { "status": "completed", "report": "received", "approved": true, "human_approved": true },
    "implement.documentation": {
      "status": "completed",
      "report": "received",
      "human_approved": true,
      "prd_created_or_updated": true,
      "sync_prd_ok": true
    },
    "deliver.scope_comment": { "status": "completed", "gate_decision": "skip" }
  },
  "pr_extras_register": [
    { "path": "AGENTS.md", "reason": "Step 7 documentation", "step_id": "implement.documentation" },
    { "path": "prds/Example.Api/prd-iris-generated.md", "reason": "PRD sync", "step_id": "implement.documentation" }
  ],
  "rework": {
    "validator_loops": 2,
    "builder_to_bugbot_loops": 0,
    "post_repair_required": false
  },
  "receipt_ids": [
    "ae57a681-0000-4000-8000-000000000001",
    "c3cb3c07-0000-4000-8000-000000000002",
    "b52a05e2-0000-4000-8000-000000000003"
  ],
  "created_at": "2026-08-31T17:12:00Z",
  "updated_at": "2026-09-01T05:19:00Z"
}
